{
  "protocolVersion": 1,
  "messageId": "11111111-1111-4111-8111-111111111111",
  "sessionId": null,
  "type": "Hello",
  "sentAtUtc": "2026-09-20T00:00:00.000Z",
  "replyTo": null,
  "payload": {
    "supportedProtocolVersions": [1],
    "extensionVersion": "0.0.0-fixture",
    "browserFamily": "edge",
    "capabilities": []
  }
}
