{
  "protocolVersion": 1,
  "messageId": "44444444-4444-4444-8444-444444444444",
  "sessionId": "33333333-3333-4333-8333-333333333333",
  "type": "CommandResult",
  "sentAtUtc": "2026-09-20T00:00:00.200Z",
  "replyTo": "55555555-5555-4555-8555-555555555555",
  "payload": {
    "status": "accepted",
    "code": "OK",
    "detail": "accepted fixture"
  }
}
